{
  "$schema": "../../pattern.schema.json",
  "id": "caption-word-highlight",
  "title": "Legenda palavra a palavra sincronizada com a voz",
  "description": "Legenda em blocos curtos; cada palavra acende (cor + leve pop) no instante em que é falada. Tempos vêm do timestamp por palavra (faster-whisper) da narração.",
  "status": "pronto",
  "duration_s": 3.0,
  "format": {
    "width": 1080,
    "height": 1920,
    "fps": 30
  },
  "params": [
    {
      "id": "words",
      "type": "string",
      "label": "Palavras com tempo 'palavra@s' (|)",
      "default": "Chama@0.2|a@0.5|gente@0.65|no@0.95|WhatsApp@1.1|e@1.7|volte@1.85|pro@2.15|jogo@2.3"
    },
    {
      "id": "chunk",
      "type": "number",
      "label": "Palavras por bloco",
      "default": 3
    },
    {
      "id": "primary",
      "type": "color",
      "label": "Cor primária",
      "default": "#e50914"
    },
    {
      "id": "secondary",
      "type": "color",
      "label": "Cor secundária",
      "default": "#1565ff"
    }
  ],
  "files": {
    "block": "block.html",
    "preview": "preview.png"
  },
  "category": "legenda",
  "tags": [
    "legenda",
    "acessibilidade",
    "sincronia-fala",
    "tts"
  ],
  "use_when": "Reels com narração: legenda queimada sincronizada com os timestamps da voz (Gemini/ElevenLabs/local).",
  "source": {
    "kind": "artigo",
    "ref": "Opus 5.5 + HyperFrames five-step workflow (transcrever → beats → skills → verificação)",
    "url": "https://openclawdatabase.com/news/videos/2026-09-25-opus-55-hyperframes-video-editing-workflow/"
  },
  "preview_at": 1.25,
  "sync": "words = saída de palavra@início do faster-whisper sobre a narração final"
}
